{
  "id": "a_numeric_answer",
  "type": "numeric_answer",
  "title": "Numeric Answer",
  "trainer": {
    "cue": "Facilitate this activity; this cue is private.",
    "explanation": "Private debrief planning; public feedback belongs in activity.explanation.",
    "talking_points": [
      "Connect the evidence to the objective."
    ],
    "expected_answer": "Discuss only after the applicable reveal.",
    "common_mistakes": [
      "Do not read private cues aloud."
    ],
    "transition": "Close, reveal when appropriate, then move to the next node."
  },
  "content": {
    "correct_answer": 42,
    "tolerance": 0.5,
    "min": 0,
    "max": 100,
    "step": 1
  },
  "results_display": "bar",
  "explanation": "42 is correct."
}
