{
  "id": "a_single_choice",
  "type": "single_choice",
  "title": "Single Choice",
  "trainer": {
    "cue": "Facilitate this activity; this cue is private.",
    "explanation": "Private debrief planning; public feedback belongs in activity.explanation.",
    "talking_points": [
      "Connect the evidence to the objective."
    ],
    "expected_answer": "Discuss only after the applicable reveal.",
    "common_mistakes": [
      "Do not read private cues aloud."
    ],
    "transition": "Close, reveal when appropriate, then move to the next node."
  },
  "content": {
    "options": [
      "A",
      "B",
      "C"
    ],
    "correct_answer": "B"
  },
  "results_display": "bar",
  "explanation": "B is correct."
}
