{
  "id": "a_q_and_a",
  "type": "q_and_a",
  "title": "Q&A",
  "trainer": {
    "cue": "Facilitate this activity; this cue is private.",
    "explanation": "Private debrief planning; public feedback belongs in activity.explanation.",
    "talking_points": [
      "Connect the evidence to the objective."
    ],
    "expected_answer": "Discuss only after the applicable reveal.",
    "common_mistakes": [
      "Do not read private cues aloud."
    ],
    "transition": "Close, reveal when appropriate, then move to the next node."
  },
  "content": {
    "question": "Q&A",
    "blocks": [
      {
        "type": "text",
        "title": "Q&A",
        "body_md": "Certification content for q_and_a"
      }
    ]
  },
  "results_display": "qa_board",
  "q_and_a": {
    "max_questions": 3,
    "max_characters": 280,
    "moderation": "off",
    "identity_visibility": "public",
    "upvoting": true,
    "allow_self_upvote": false,
    "sort": "votes"
  }
}
